{
  "schema_version": 1,
  "contract_id": "terminal-redeemer.host-leech-slices",
  "contract_version": "1.2.0",
  "protocol": {
    "inventory_schema_versions": [1],
    "rpc_schema_versions": [1],
    "controller_schema_versions": [2],
    "workspace_normalization": "unicode-nfkc-fold-v1"
  },
  "compatibility": {
    "niri_version": "26.04",
    "zellij_version": "0.44.3",
    "topology": "one_active_output_per_machine"
  },
  "defaults": {
    "leech_mode_enabled": false,
    "controller_enabled": false,
    "slice_clipboard_enabled": false,
    "authority_mode": "host_location",
    "leech_write_authorized": false,
    "poll_interval": "2s",
    "control_timeout": "5s",
    "retry_window": "30s",
    "source_gone_grace": "5s",
    "source_gone_confirmations": 2
  },
  "selection": {
    "formula": "(all_eligible OR selected_workspace OR exact_pickup) AND NOT closed_by_user",
    "all_eligible_scope": "current_and_future_eligible_sources_including_unnamed_workspaces",
    "unnamed_spatial_policy": "attach_without_cross_machine_spatial_placement",
    "routed_launch_policy": "explicit_selected_named_workspaces_only",
    "all_eligible_state_field": "optional_omitempty_boolean",
    "all_eligible_undoable": false,
    "prior_reader_behavior_when_enabled": "reject_unknown_field",
    "downgrade_requires_disable_first": true
  },
  "authority": {
    "supported_modes": ["host_location"],
    "converged_properties": ["workspace", "floating_or_tiled", "proportional_width", "proportional_height"],
    "local_supported_drift_policy": "revert_to_host",
    "order_policy": "initial_best_effort_then_observation_only",
    "leech_location_configurable": false,
    "host_spatial_writeback_available": false
  },
  "drops": {
    "key": "exact_verified_zellij_session_id",
    "survives_source_replacement": true,
    "survives_source_epoch_replacement": true,
    "survives_headless_while_session_live": true,
    "early_clear_operations": ["reopen", "undo"],
    "automatic_expiry_requires": ["accepted_higher_complete_revisions", "consecutive_confirmed_session_absence", "committed_grace_elapsed"],
    "non_authoritative_observations_do_not_advance": true
  },
  "revisions": {
    "complete_poll_advances_revision": true,
    "unchanged_semantics_still_advances_revision": true,
    "same_revision_same_semantics": "idempotent_replay",
    "same_revision_different_semantics": "conflict",
    "non_authoritative_observations": ["degraded", "duplicate", "stale", "conflicting", "retired_epoch", "transport_disconnected"]
  },
  "commands": {
    "inventory_init": ["$REDEEM", "slice", "inventory", "init"],
    "inventory_snapshot": ["$REDEEM", "slice", "inventory", "snapshot", "--accept-schema-version", "1"],
    "rpc": ["$REDEEM", "slice", "rpc"],
    "launch": ["$REDEEM", "slice", "launch"],
    "launch_reconnect": ["$REDEEM", "slice", "launch", "--reconnect-token", "$TOKEN"],
    "close_focused": ["$REDEEM", "slice", "close-focused"],
    "manage": ["$REDEEM", "slice", "manage"],
    "controller_init": ["$REDEEM", "slice", "controller", "init"],
    "controller_run": ["$REDEEM", "slice", "controller", "run"],
    "controller_status": ["$REDEEM", "slice", "controller", "status"],
    "controller_operations": ["workspace-add", "workspace-remove", "all-enable", "all-disable", "pickup", "pickup-remove", "drop", "close", "reopen", "undo", "reconnect", "launch-handoff"],
    "mode_enable": ["$REDEEM", "slice", "mode", "enable"],
    "mode_disable": ["$REDEEM", "slice", "mode", "disable"],
    "mode_status": ["$REDEEM", "slice", "mode", "status"],
    "legacy_attach": ["$REDEEM", "mirror", "open", "--mode", "attach"]
  },
  "module": {
    "home_manager": "homeManagerModules.terminal-redeemer",
    "nixos": "nixosModules.terminal-redeemer",
    "package": "packages.x86_64-linux.terminal-redeemer",
    "app": "apps.x86_64-linux.redeem",
    "contract_package": "packages.x86_64-linux.host-leech-consumer-contract",
    "contract_library": "lib.sliceConsumerContract"
  },
  "configuration": {
    "namespace": "programs.terminal-redeemer.slice",
    "typed_options": [
      "leechMode.enable",
      "sourceHost",
      "selfCommand",
      "kittyCommand",
      "transportCommand",
      "transportOptions",
      "rpcCommand",
      "zellijCommand",
      "niriCommand",
      "systemctlCommand",
      "requestTimeout",
      "keepaliveInterval",
      "keepaliveCount",
      "retryMaxAttempts",
      "retryInitialBackoff",
      "retryMaxBackoff",
      "attachPrivateRoot",
      "attachShimCache",
      "controller.enable",
      "controller.hostID",
      "controller.leechID",
      "controller.pollInterval",
      "controller.controlTimeout",
      "controller.retryWindow",
      "controller.sourceGoneGrace",
      "controller.sourceGoneConfirmations"
    ],
    "read_only_options": ["launchCommand", "closeFocusedCommand", "manageCommand", "niriIntegrationFragment", "clipboard.enabled"],
    "unsupported_options": ["controller.authorityMode", "controller.leechWriteAuthorized"]
  },
  "integration": {
    "launch_helper_option": "programs.terminal-redeemer.slice.launchCommand",
    "close_helper_option": "programs.terminal-redeemer.slice.closeFocusedCommand",
    "manage_helper_option": "programs.terminal-redeemer.slice.manageCommand",
    "generated_niri_option": "programs.terminal-redeemer.slice.niriIntegrationFragment",
    "packaged_niri_path": "share/terminal-redeemer/host-leech-slices/v1/niri-bindings.kdl",
    "launch_binding": "Mod+Return",
    "close_binding": "Mod+W",
    "bindings_installed_automatically": false
  },
  "limitations": {
    "zellij_shared_minimum_client_grid_reflow": true,
    "spatial_placement": "approximate_proportional",
    "pinned_version_coupling": true,
    "ambiguous_transport_may_have_created_host_work": true,
    "routed_launch_process_correlation_can_remain_pending": true
  },
  "rollout": {
    "installs_niri_bindings": false,
    "legacy_attach_retained": true,
    "watch_supported": false,
    "automatic_local_fallback_after_remote_intent": false
  },
  "future_work": [
    "exact_live_column_order",
    "multi_monitor_topology",
    "slice_clipboard_sync",
    "named_slices",
    "read_only_watch_projection"
  ]
}
